<?xml version="1.0" encoding="utf-8" standalone="no"?>
<?xml-stylesheet type="text/xsl" href="gesture_data.xsl"?>
<!DOCTYPE gestures SYSTEM "gesture_data.dtd">
<gestures>
	<gesture>
		<hand side="left">
			<thumb>
				<flex>0</flex>
				<contact-tip>false</contact-tip>
			</thumb>
			<index>
				<flex>0</flex>
				<contact-tip>false</contact-tip>
				<contact-mid>false</contact-mid>
			</index>
			<middle>
				<flex>0</flex>
				<contact-tip>false</contact-tip>
				<contact-mid>false</contact-mid>
			</middle>
			<ring>
				<flex>0</flex>
				<contact-tip>false</contact-tip>
				<contact-mid>false</contact-mid>
			</ring>
			<pinky>
				<flex>0</flex>
				<contact-tip>false</contact-tip>
				<contact-mid>false</contact-mid>
			</pinky>
			<thumb-index>
				<contact-tip>false</contact-tip>
			</thumb-index>
			<index-middle>
				<contact-tip>false</contact-tip>
			</index-middle>
			<middle-ring>
				<contact-tip>false</contact-tip>
			</middle-ring>
			<ring-pinky>
				<contact-tip>false</contact-tip>
			</ring-pinky>
			<lsm303 side="top">
				<accel-x>0</accel-x>
				<accel-y>0</accel-y>
				<accel-z>0</accel-z>
				<mag-x>0</mag-x>
				<mag-y>0</mag-y>
				<mag-z>0</mag-z>
			</lsm303>
			<lsm303 side="bottom">
				<accel-x>0</accel-x>
				<accel-y>0</accel-y>
				<accel-z>0</accel-z>
				<mag-x>0</mag-x>
				<mag-y>0</mag-y>
				<mag-z>0</mag-z>
			</lsm303>
			<lsm9dof side="top">
				<accel-x>0</accel-x>
				<accel-y>0</accel-y>
				<accel-z>0</accel-z>
				<mag-x>0</mag-x>
				<mag-y>0</mag-y>
				<mag-z>0</mag-z>
				<gyro-x>0</gyro-x>
				<gyro-y>0</gyro-y>
				<gyro-z>0</gyro-z>
			</lsm9dof>
			<lsm9dof side="bottom">
				<accel-x>0</accel-x>
				<accel-y>0</accel-y>
				<accel-z>0</accel-z>
				<mag-x>0</mag-x>
				<mag-y>0</mag-y>
				<mag-z>0</mag-z>
				<gyro-x>0</gyro-x>
				<gyro-y>0</gyro-y>
				<gyro-z>0</gyro-z>
			</lsm9dof>
		</hand>
		<hand side="right">
			<thumb>
				<flex>0</flex>
				<contact-tip>false</contact-tip>
			</thumb>
			<index>
				<flex>95</flex>
				<contact-tip>false</contact-tip>
				<contact-mid>false</contact-mid>
			</index>
			<middle>
				<flex>70</flex>
				<contact-tip>false</contact-tip>
				<contact-mid>false</contact-mid>
			</middle>
			<ring>
				<flex>95</flex>
				<contact-tip>false</contact-tip>
				<contact-mid>false</contact-mid>
			</ring>
			<pinky>
				<flex>5</flex>
				<contact-tip>false</contact-tip>
				<contact-mid>false</contact-mid>
			</pinky>
			<thumb-index>
				<contact-tip>false</contact-tip>
			</thumb-index>
			<index-middle>
				<contact-tip>true</contact-tip>
			</index-middle>
			<middle-ring>
				<contact-tip>true</contact-tip>
			</middle-ring>
			<ring-pinky>
				<contact-tip>false</contact-tip>
			</ring-pinky>
			<lsm303 side="top">
				<accel-x>-976</accel-x>
				<accel-y>-24</accel-y>
				<accel-z>-300</accel-z>
				<mag-x>518</mag-x>
				<mag-y>-362</mag-y>
				<mag-z>78</mag-z>
			</lsm303>
			<lsm303 side="bottom">
				<accel-x>-976</accel-x>
				<accel-y>-12</accel-y>
				<accel-z>32</accel-z>
				<mag-x>615</mag-x>
				<mag-y>-198</mag-y>
				<mag-z>200</mag-z>
			</lsm303>
			<lsm9dof side="top">
				<accel-x>-17258</accel-x>
				<accel-y>1258</accel-y>
				<accel-z>-4654</accel-z>
				<mag-x>2983</mag-x>
				<mag-y>1804</mag-y>
				<mag-z>-2482</mag-z>
				<gyro-x>120</gyro-x>
				<gyro-y>490</gyro-y>
				<gyro-z>-243</gyro-z>
			</lsm9dof>
			<lsm9dof side="bottom">
				<accel-x>-16980</accel-x>
				<accel-y>-21</accel-y>
				<accel-z>-7617</accel-z>
				<mag-x>4823</mag-x>
				<mag-y>4489</mag-y>
				<mag-z>-1366</mag-z>
				<gyro-x>73</gyro-x>
				<gyro-y>110</gyro-y>
				<gyro-z>-316</gyro-z>
			</lsm9dof>
		</hand>
	</gesture>
		<converted-text></converted-text>
	<status>connected</status>
	<version>1.0</version>
</gestures>
