<?xml version="1.0" encoding="utf-8" standalone="no"?>
<?xml-stylesheet type="text/xsl" href="gesture_data.xsl"?>
<!DOCTYPE gestures SYSTEM "gesture_data.dtd">
<gestures>
	<gesture>
		<hand side="left">
			<thumb>
				<flex>0</flex>
				<contact-tip>0</contact-tip>
			</thumb>
			<index>
				<flex>0</flex>
				<contact-tip>0</contact-tip>
				<contact-mid>0</contact-mid>
			</index>
			<middle>
				<flex>0</flex>
				<contact-tip>0</contact-tip>
				<contact-mid>0</contact-mid>
			</middle>
			<ring>
				<flex>0</flex>
				<contact-tip>0</contact-tip>
				<contact-mid>0</contact-mid>
			</ring>
			<pinky>
				<flex>0</flex>
				<contact-tip>0</contact-tip>
				<contact-mid>0</contact-mid>
			</pinky>
			<thumb-index>
				<contact-tip>0</contact-tip>
			</thumb-index>
			<index-middle>
				<contact-tip>0</contact-tip>
			</index-middle>
			<middle-ring>
				<contact-tip>0</contact-tip>
			</middle-ring>
			<ring-pinky>
				<contact-tip>0</contact-tip>
			</ring-pinky>
			<lsm303 side="top">
				<accel-x>0</accel-x>
				<accel-y>0</accel-y>
				<accel-z>0</accel-z>
				<mag-x>0</mag-x>
				<mag-y>0</mag-y>
				<mag-z>0</mag-z>
			</lsm303>
			<lsm303 side="bottom">
				<accel-x>0</accel-x>
				<accel-y>0</accel-y>
				<accel-z>0</accel-z>
				<mag-x>0</mag-x>
				<mag-y>0</mag-y>
				<mag-z>0</mag-z>
			</lsm303>
			<lsm9dof side="top">
				<accel-x>0</accel-x>
				<accel-y>0</accel-y>
				<accel-z>0</accel-z>
				<mag-x>0</mag-x>
				<mag-y>0</mag-y>
				<mag-z>0</mag-z>
				<gyro-x>0</gyro-x>
				<gyro-y>0</gyro-y>
				<gyro-z>0</gyro-z>
			</lsm9dof>
			<lsm9dof side="bottom">
				<accel-x>0</accel-x>
				<accel-y>0</accel-y>
				<accel-z>0</accel-z>
				<mag-x>0</mag-x>
				<mag-y>0</mag-y>
				<mag-z>0</mag-z>
				<gyro-x>0</gyro-x>
				<gyro-y>0</gyro-y>
				<gyro-z>0</gyro-z>
			</lsm9dof>
		</hand>
		<hand side="right">
			<thumb>
				<flex>0</flex>
				<contact-tip>0</contact-tip>
			</thumb>
			<index>
				<flex>65</flex>
				<contact-tip>0</contact-tip>
				<contact-mid>0</contact-mid>
			</index>
			<middle>
				<flex>70</flex>
				<contact-tip>0</contact-tip>
				<contact-mid>0</contact-mid>
			</middle>
			<ring>
				<flex>90</flex>
				<contact-tip>0</contact-tip>
				<contact-mid>0</contact-mid>
			</ring>
			<pinky>
				<flex>75</flex>
				<contact-tip>0</contact-tip>
				<contact-mid>0</contact-mid>
			</pinky>
			<thumb-index>
				<contact-tip>0</contact-tip>
			</thumb-index>
			<index-middle>
				<contact-tip>0</contact-tip>
			</index-middle>
			<middle-ring>
				<contact-tip>0</contact-tip>
			</middle-ring>
			<ring-pinky>
				<contact-tip>0</contact-tip>
			</ring-pinky>
			<lsm303 side="top">
				<accel-x>-600</accel-x>
				<accel-y>436</accel-y>
				<accel-z>688</accel-z>
				<mag-x>598</mag-x>
				<mag-y>-147</mag-y>
				<mag-z>-283</mag-z>
			</lsm303>
			<lsm303 side="bottom">
				<accel-x>-220</accel-x>
				<accel-y>332</accel-y>
				<accel-z>892</accel-z>
				<mag-x>465</mag-x>
				<mag-y>-65</mag-y>
				<mag-z>-272</mag-z>
			</lsm303>
			<lsm9dof side="top">
				<accel-x>-7982</accel-x>
				<accel-y>4788</accel-y>
				<accel-z>14619</accel-z>
				<mag-x>3110</mag-x>
				<mag-y>4820</mag-y>
				<mag-z>4664</mag-z>
				<gyro-x>116</gyro-x>
				<gyro-y>451</gyro-y>
				<gyro-z>-233</gyro-z>
			</lsm9dof>
			<lsm9dof side="bottom">
				<accel-x>-8092</accel-x>
				<accel-y>-2467</accel-y>
				<accel-z>14405</accel-z>
				<mag-x>4004</mag-x>
				<mag-y>8389</mag-y>
				<mag-z>3529</mag-z>
				<gyro-x>79</gyro-x>
				<gyro-y>142</gyro-y>
				<gyro-z>-425</gyro-z>
			</lsm9dof>
		</hand>
	</gesture>
		<converted-text></converted-text>
	<status>connected</status>
	<convert>false</convert>
	<version>1.0</version>
</gestures>
